{
  "schema": 1,
  "id": "ste-68000-1m-256k-us",
  "milestone": "M3.1",
  "machine": {
    "family": "Atari STe",
    "representative_models": ["520STe", "1040STe"],
    "hatari_machine": "ste",
    "cpu": "68000",
    "cpu_level": 0,
    "cpu_clock_mhz": 8,
    "st_ram_kib": 1024,
    "fast_ram_kib": 0
  },
  "rom": {
    "size_kib": 256,
    "country": "us",
    "source": "pinned-free-baseline"
  },
  "display": {
    "monitor": "color",
    "initial_resolution": "st-low",
    "palette_entries": 16,
    "palette_color_space": 4096
  },
  "platform_features": {
    "ste_enhanced_shifter": true,
    "dma_sound": true,
    "blitter": true,
    "hardware_scrolling": true
  },
  "storage": {
    "floppy_drives": 1,
    "boot_device": "rom",
    "hard_disk_required": false
  },
  "qualification": {
    "emulator": "Hatari",
    "compatible_mode": true,
    "fast_boot": false,
    "sound": false,
    "minimum_vbls": 500,
    "proprietary_atari_rom_required": false,
    "must_regress": ["st-68000-1m-192k-us"]
  }
}
